{
  "action": "image",
  "next_checkin_seconds": 600,
  "reason_codes": [
    "coverage_changed"
  ],
  "assignment": {
    "id": "00000000-0000-4000-8000-000000000014",
    "project_id": "00000000-0000-4000-8000-000000000001",
    "project_revision": 1,
    "created_at": "2026-10-04T04:00:00Z",
    "expires_at": "2026-10-05T04:00:00Z",
    "panels": [
      {
        "id": "00000000-0000-4000-8000-000000000015",
        "target_id": "00000000-0000-4000-8000-000000000004",
        "objective_ids": [
          "00000000-0000-4000-8000-000000000005"
        ],
        "footprint": {
          "center": {
            "ra_degrees": 10.6847,
            "dec_degrees": 41.269
          },
          "width_degrees": 3.36,
          "height_degrees": 2.24,
          "position_angle_degrees": 0
        },
        "overlap_fraction": 0.15,
        "equipment": {
          "equipment_id": "00000000-0000-4000-8000-000000000007",
          "revision": 1
        },
        "filter_id": "00000000-0000-4000-8000-000000000008",
        "exposure_seconds": 300,
        "suggested_frames": 96,
        "target_name": "M31 outer disk"
      }
    ],
    "estimated_rig_seconds": 34560,
    "estimated_accepted_integration_seconds": 23040,
    "notes": [
      "20 percent acquisition overhead.",
      "80 percent of captured integration expected to pass quality.",
      "Whole target fits within the confirmed fixed-angle camera field."
    ]
  }
}
